{
  "authorityNamespaceId": {
    "tenantNamespace": "default",
    "controlPlaneId": "default",
    "authorityScopeId": "marshal-harness"
  },
  "observation": "applied",
  "decision": "accept",
  "intentDigest": "sha256:aaaaaaaaaaaaaaaaaaaaaaaaaaaaaaaaaaaaaaaaaaaaaaaaaaaaaaaaaaaaaaaa",
  "receiptDigest": "sha256:cccccccccccccccccccccccccccccccccccccccccccccccccccccccccccccccc"
}
